QphJEO9ZX6s,UCKWaEZ-_VweaEx1j62do_vQ,Blockchain Explained,28,"Blockchain, cryptocurrency, hyperledger, hyperledger fabric, ledger, security, cloud security, block chain, IBM, permissioned blockchain, permissionless blockchain, IBM Cloud, IBM Blockchain, smart contracts, cloud computing, containers",IBM Technology,610000,210032,3722,0,123,https://www.youtube.com/watch?v=QphJEO9ZX6s,en,PT10M23S,623,Blockchain Technology
4FU3tc-foaI,UCumqVKxP52KPn4rY9ZwvePw,Blockchain in 3 Minuten erklärt,27,"erklärvideo, erklärfilm, simpleshow, explainity, explanatory video, explanation video, erklär-video, explainer video, erklärung, explainr, erklären, Blockchain, Bitcoins, Kryptowährungen, Kryptowährung, Bitcoin, Datenspeicherung, Dezentrales System, Dezentrale Speicherung, erklärvideos, erklärfilme, erklärungsvideo, youknow, explainit",youknow,47600,319908,4098,0,225,https://www.youtube.com/watch?v=4FU3tc-foaI,de,PT3M6S,186,Blockchain Technology
RaQKTgGyyyo,UCN3-BVMnr44LIUheSuppw1A,What is Blockchain and How It Works? – [Hindi] – Quick Support,22,"What is Blockchain and How It Works?, What is Blockchain and How It Works in Hindi?, Blockchain Kya Hain Aur Kaise Work Karta Hain?, blockchain technology explained, blockchain tutorial, How blockchain works step-by-step, blockchain explained simply, blockchain technology, blockchain definition, blockchain meaning, Difference between banking and blockchain",Quick Support,6810000,709961,22858,0,887,https://www.youtube.com/watch?v=RaQKTgGyyyo,hi,PT6M42S,402,Blockchain Technology
mr2l_QWebxY,UC3oKOKlDjM93TKyKLSCOWSQ,Blockchain and Cryptocurrency Explained in Malayalam | What is Bitcoin?  How does it work?,22,"bitcoin kerala, bitcoin malayalam, bitcoin trading, bitcoin news, introduction to bitcoin, introduction to bitcoin malayalam, what is bitcoin, cryptocurrency malayalam, bitcoin mining, cryptocurrency kerala, what is cryptocurrency, blockchain, bitcoin explained, sharique samsudheen, aswin madappally, blockchain malayalam, blockchain explained, blockchain easy explanation, introduction to blockchain, dhruv rathee, alexplain, upsc, kas, psc, ssc, cgl, mains, morris coin",alexplain,606000,255522,13048,0,1025,https://www.youtube.com/watch?v=mr2l_QWebxY,ml,PT16M35S,995,Blockchain Technology
9QmipnimwVE,UCv-OBAd6y1GeNK1Qx1aaJjg,What is blockchain? Explained in a minute #shorts #blockchain #technology,27,"what is blockchain, what is bitcoin, what is blakchain, decentralized blockchain",VROOK Engineering,11700,93833,5431,0,43,https://www.youtube.com/watch?v=9QmipnimwVE,en,PT59S,59,Blockchain Technology
kHybf1aC-jE,UCsYYksPHiGqXHPoHI-fm5sg,What is a Blockchain? (Animated + Examples),22,N/A,Whiteboard Crypto,876000,503471,22398,0,573,https://www.youtube.com/watch?v=kHybf1aC-jE,en,PT8M27S,507,Blockchain Technology
gyMwXuJrbJQ,UC8butISFwT-Wl7EV0hUK0BQ,"Learn Blockchain, Solidity, and Full Stack Web3 Development with JavaScript – 32-Hour Course",27,N/A,freeCodeCamp.org,8820000,2476919,57334,0,3189,https://www.youtube.com/watch?v=gyMwXuJrbJQ,en,P1DT7H54M31S,0,Blockchain Technology
Wba_ZvpaJkk,UC59K-uG2A5ogwIrHw4bmlEg,Blockchain Technology Architecture,28,"telusko, navin, reddy, tutorial, java, python",Telusko,2180000,98612,2315,0,63,https://www.youtube.com/watch?v=Wba_ZvpaJkk,en,PT7M1S,421,Blockchain Technology
aQWflNQuP_o,UCnxrdFPXJMeHru_b4Q_vTPQ,Blockchains: how can they be used? (Use cases for Blockchains),28,"lesson, course, training, basics, basic tutorial, beginner, best practices, dummies, fundamentals, free, getting started, introduction, howto, tutorial, learn, blockchain, applications, use case, chain, blocks, bitcoin, cryptocurrency, tracking, shipments, maersk, royalties, artists, music, smart contracts, odometer, Bosch, stampd, notary, voting, digital voting, food chain, wallmart, ibm, pioneer, secure, data",Simply Explained,457000,437864,11778,0,259,https://www.youtube.com/watch?v=aQWflNQuP_o,en,PT7M8S,428,Blockchain Technology
uULy2rc6YDc,UCBwmMxybNva6P_5VmxjzwqA,How to become a Blockchain Developer in 2022?  | 🔥 Complete Roadmap + Salary + Tech Stack,27,"blockchain, apna college, blockchain development, web development roadmap, blockchain development roadmap, blockchain development tutorial, blockchain technology, blockchain tutorial, web development, blockchain developer roadmap, how to become a blockchain developer, blockchain developer, web development roadmap 2022, bockchain development roadmap 2022, blockchain tutorial for beginners, ethereum development, blockchain training, solidity, blockchain salary",Apna College,4660000,1259923,40595,0,1646,https://www.youtube.com/watch?v=uULy2rc6YDc,Unknown,PT17M11S,1031,Blockchain Technology
0uv1WaLIhBA,UCkefXKtInZ9PLsoGRtml2FQ,Blockchain Technology - SY0-601 CompTIA Security+ : 2.8,28,"security+, security+ professor messer, security+ certification, security+ training, security+ exam, security+ 601, security+ course, comptia security+, professor messer, certification, information technology, cyber security, cybersecurity, comptia certification, security plus, cyber security career, infosec, comptia security full course, security+ study guide, security+ objectives, security+ how to pass, sy0-601, blockchain",Professor Messer,825000,71232,806,0,10,https://www.youtube.com/watch?v=0uv1WaLIhBA,en,PT3M14S,194,Blockchain Technology
jKYhLpHJv8U,UCkw4JCwteGrDHIsyIIKo4tQ,Blockchain Tutorial | Blockchain Technology | Blockchain Explained | Blockchain Training | Edureka,27,"yt:cc=on, blockchain tutorial, blockchain tutorial for beginners, blockchain technology, blockchain, blockchain for beginners, blockchain explained, what is blockchain, blockchain applications, Blockchain Demystified, introduction to blockchain, blockchain examples, blockchain features, blockchain bitcoin, blockchain training, blockchain edureka, edureka, blockchain development tutorial, what is blockchain technology, learn blockchain",edureka!,3900000,450586,3837,0,211,https://www.youtube.com/watch?v=jKYhLpHJv8U,en,PT1H16M43S,4603,Blockchain Technology
Pl8OlkkwRpc,UCAuUUnT6oDeKwE6v1NGQxug,How the blockchain is changing money and business | Don Tapscott,28,"TED Talk, TED Talks, blockchain, Bitcoin, currency, economy, trust, Don Tapscott, Alex Tapscott, money, business, government, society",TED,23800000,4976694,82013,0,18429,https://www.youtube.com/watch?v=Pl8OlkkwRpc,en,PT18M50S,1130,Blockchain Technology
Yn8WGaO__ak,UCGEnJMppT6llV9RrLKyeEng,"Qué es ""Blockchain"" en 5 minutos",24,"blockchain, crypto, finanzas",PlayGround,668000,1058103,29659,0,1089,https://www.youtube.com/watch?v=Yn8WGaO__ak,es,PT5M33S,333,Blockchain Technology
6ImFBrRuGG0,UCypQjdd_Mz0yX7M7rekN4Bw,Blockchain for agricultural supply chain,28,"blockchain, agricultural supply chain, supply chain, blockchain for supply chain",Infosys,70100,72710,1312,0,33,https://www.youtube.com/watch?v=6ImFBrRuGG0,en-US,PT4M30S,270,Blockchain Technology
HuSZC3JDKrM,UCwr-evhuzGZgDFrq_1pLt_A,Blockchain Explained !! #blockchain #bitcoin #career #crypto,27,N/A,Error Makes Clever Academy,510000,205681,21136,0,68,https://www.youtube.com/watch?v=HuSZC3JDKrM,Unknown,PT1M1S,61,Blockchain Technology
giv2f1FebFA,UCe3qdG0A_gr-sEdat5y2twQ,All you need to know about Blockchain & Alt coins,27,"CA Rachana Ranade, Stock market, money, fundamental analysis, Rachana, CA Rachana, All you need to know about Blockchain & Alt coins, blockchain, blockchain technology, what is blockchain, blockchain explained, blockchain tutorial, blockchain bitcoin, blockchain technology explained, what is blockchain technology, bitcoin, blockchain documentary, altcoin, top altcoins, altcoin daily, best altcoin buys, altcoins, cryptocurrency news, best investment, crypto",CA Rachana Phadke Ranade,4650000,147853,6473,0,1108,https://www.youtube.com/watch?v=giv2f1FebFA,en,PT19M20S,1160,Blockchain Technology
1YyAzVmP9xQ,UCsvqVGtbbyHaMoevxPAq9Fg,Cryptocurrency In 5 Minutes | Cryptocurrency Explained | What Is Cryptocurrency? | Simplilearn,27,"cryptocurrency in 5 minutes, cryptocurrency explained, cryptocurrency, what is cryptocurrency?, what is crypto?, what is crypto mining, what is cryptocurrency and how does it work, what are cryptocurrencies, cryptocurrency for beginners, crypto mining, cryptocurrency trading, cryptocurrency mining, all about cryptocurrency, cryptocurrency and blockchain, cryptocurrency and bitcoin explained, malta cryptocurrency, blockchain technology, cryptocurrency simplilearn, simplilearn",Simplilearn,3540000,1112300,20260,0,1602,https://www.youtube.com/watch?v=1YyAzVmP9xQ,en,PT5M33S,333,Blockchain Technology
Yin8sWCmMh0,UC8hasSBuv9VtRwtuEXf3haA,Ethereum founder talks about future of blockchain technology,27,"#VitalikButerin, #startup, #ethereum, #entrepreneur",Shorts by Aalas,3460,20541,756,0,14,https://www.youtube.com/watch?v=Yin8sWCmMh0,Unknown,PT42S,42,Blockchain Technology
QCvL-DWcojc,UCkw4JCwteGrDHIsyIIKo4tQ,Blockchain Full Course - 4 Hours | Blockchain Tutorial | Blockchain Technology Explained | Edureka,27,"yt:cc=on, blockchain, block chain, blockchain tutorial, blockchain tutorial for beginners, blockchain full course, blockchain technology, blockchain explained, blockchain applications, blockchain wallet, blockchain bitcoin, ethereum blockchain tutorial, learn blockchain technology, blockchain training, what is blockchain, decentralized applications, blockchain edureka, ethereum developer, ethereum tutorial, blockchain development tutorial, smart contracts, ethereum solidity",edureka!,3900000,1038101,21947,0,226,https://www.youtube.com/watch?v=QCvL-DWcojc,en,PT4H18M25S,15505,Blockchain Technology
pSTNhBlfV_s,UCmKtn_HvpfbTu3QV4lhJIMw,Watch Crypto expert explain the Blockchain to Congress,28,"event, livestream, 2020, live",CNET Highlights,372000,4916598,119262,0,9449,https://www.youtube.com/watch?v=pSTNhBlfV_s,en,PT5M56S,356,Blockchain Technology
_wKXnQUEUH8,UCFVMB7Pwxg91TrwJqM4hhOQ,Learn Blockchain for Free 🔥 #shorts,28,"blockchain, learn blockchain development, learn blockchain, learn programming, learn coding, developer",Tech Believers,237000,19590,1913,0,18,https://www.youtube.com/watch?v=_wKXnQUEUH8,hi,PT39S,39,Blockchain Technology
r43LhSUUGTQ,UCfO9dW0L2vLc8s9qgZunUFA,Understand the Blockchain in Two Minutes,29,"blockchain, blockchain futures lab, iftf, institute for the future, blockchain explained",Institute for the Future (IFTF),24100,3117767,15454,0,2406,https://www.youtube.com/watch?v=r43LhSUUGTQ,en,PT2M26S,146,Blockchain Technology
F8xaRkRrujI,UC5NOEUbkLheQcaaRldYW5GA,#kurzerklärt: Was ist eine Blockchain?,25,"Blockchain, Bitcoin, Vernetzung, Informationen, Daten, Kryptowährungen, Banken, Logistik, Smart Contracts, automatisch, Beschleunigung, Jobkiller, Digitalisierung",tagesschau,1450000,223792,1638,0,0,https://www.youtube.com/watch?v=F8xaRkRrujI,de,PT2M1S,121,Blockchain Technology
baJYhYsHkLM,UCrYmtJBtLdtm2ov84ulV-yg,Building a Blockchain in Under 15 Minutes - Programmer explains,28,"bitcoin blockchain, ethereum blockchain, bitcoin, ethereum, cryptocurrencies, blockchain, crypto blockchain, Building a Blockchain in Under 15 Minutes, programming blockchain, blockchain programming, Programmer explains, ivan on tech, java programming blockchain, blockchain from scratch, iota, nem, neo, lisk, eth",Ivan on Tech,508000,804859,17678,0,948,https://www.youtube.com/watch?v=baJYhYsHkLM,en-US,PT14M28S,868,Blockchain Technology
XaTqdCgbk7Y,UCEECWUqzuIEy1qRgV4z5u2Q,WHAT IS BLOCKCHAIN? | Blockchain Explained in 3 Minutes (Animation),27,"what is blockchain, blockchain explained in 3 minutes, blockchain explained, what is blockchain technology, what is blockchain and how does it work, what is blockchain and how it works, what is blockchain how it works, blockchain explained animation, blockchain explained 2022, explanation of blockchain, blockchain for dummies, how does blockchain work, blockchain technology explained, blockchain, technology, what is, tech, bitcoin, monkey go, #blockchain, introduction to blockchain",Monkey Go,1650,28022,361,0,4,https://www.youtube.com/watch?v=XaTqdCgbk7Y,en,PT2M53S,173,Blockchain Technology
54zLlah-YbI,UCKc0J2A7znmiFwIjXUvmdvw,Lecture 4 - What is Blockchain? | How Blockchain Technology works?,28,"blockchainirfanmalik, xeven, xevenskills, freecoursesonline, whatisblockchain?, what is blockchain technology, blockchaintechnologybyirfan, what is blockchain and how does it work, blockchainexplainedbyirfan, blockchain technology explained by irfan malik, howblockchainworks, explanationofblockchain, introduction to blockchain by irfan malik, what is blockchain 2022, irfan malik success story, irfan malik xeven solutions, irfanmalikblockchaininterview, blockchaintutorialirfan, blockchainlectureirfan",Irfan Malik,238000,13833,687,0,135,https://www.youtube.com/watch?v=54zLlah-YbI,Unknown,PT15M18S,918,Blockchain Technology
N3VDgS8gPIE,UCRZOdgYkuviPNea1AXqi91w,What is Blockchain Technology? | Tamil Pokkisham Shorts,22,"TPShorts, TamilpokkishamShorts, Tamil Pokkisham Shorts",Tamil Pokkisham Shorts,14700,65835,4033,0,22,https://www.youtube.com/watch?v=N3VDgS8gPIE,Unknown,PT1M,60,Blockchain Technology
yR2wWQYiVKM,UCsvqVGtbbyHaMoevxPAq9Fg,Data Science vs Big Data vs Data Analytics | Simplilearn,27,"simplilearn, training, tutorial, certification, course, curriculum, Free resources, Data Science, Big Data, Data Analytics, Hadoop, 2016, Comparison, Difference, Best, Jobs, Salary, Data Scientist, Advanced, Business Analytics, Excel, SAS, R Programming",Simplilearn,3540000,315176,3324,0,86,https://www.youtube.com/watch?v=yR2wWQYiVKM,en,PT1M40S,100,Data Science and Analytics
T08eJt9DlgU,UCzAF54cHk1ZO82af-8E3qOQ,Data Scientist vs Data Analyst - Which Is Right For You? (2023),27,"The Difference Between Data Analytics And Data Science, Data Science Vs Data Analytics, data analyst, data science, data analytics, data scientist, data analyst career, data analyst job, data scientist vs data analyst, data analyst skills, what is data science, data analytics career, data science career, data science tutorial for beginners, how to become a data analyst, data science learning, how to data science, What IS Data Science, What IS Data Analytics, CareerFoundry",CareerFoundry,230000,50121,1472,0,31,https://www.youtube.com/watch?v=T08eJt9DlgU,en,PT7M2S,422,Data Science and Analytics
fUpChfNN5Uo,UC7cs8q-gJRlGwj4A8OmCmXg,Data Scientist vs Data Analyst | Which Is Right For You?,27,"Data Analyst, How to become a data analyst, Data Analyst job, Data Analyst Career, Data Analytics, Data Scientist, Data scientist vs data analyst, data analyst vs data scientist, data scientist job, data scientist salary, Data scientist job description, Data Analyst Job Description, Data Analyst Salary, Data Analyst skills, data scientist career, Data scientist or data analyst, data analyst or data scientist, data analyst for freshers, data scientist for freshers",Alex The Analyst,650000,754956,23613,0,851,https://www.youtube.com/watch?v=fUpChfNN5Uo,en,PT7M47S,467,Data Science and Analytics
dcXqhMqhZUo,UCKWaEZ-_VweaEx1j62do_vQ,Data Analytics vs Data Science,27,"IBM, IBM Cloud",IBM Technology,610000,38853,1142,0,29,https://www.youtube.com/watch?v=dcXqhMqhZUo,en-US,PT6M30S,390,Data Science and Analytics
LDds33bJy6g,UCLLw7jmFsvfIVaUFsLs8mlQ,Degrees vs. Experience in Data Science 📜 🆚 📊,28,"data viz by luke, business intelligence, data science, bi, computer science, data nerd, data analyst, data scientist, how to, data project, data analytics, portfolio project, sql, excel, python, power bi, tableau, data engineer",Luke Barousse,398000,40993,2417,0,36,https://www.youtube.com/watch?v=LDds33bJy6g,en-US,PT44S,44,Data Science and Analytics
60TtNPlq3_k,UCLLw7jmFsvfIVaUFsLs8mlQ,How I use Math as a Data Analyst,28,"data viz by luke, business intelligence, data science, bi, computer science, data nerd, data analyst, data scientist, how to, data project, data analytics, portfolio project, sql, excel, python, power bi, tableau, data engineer",Luke Barousse,398000,61209,3515,0,27,https://www.youtube.com/watch?v=60TtNPlq3_k,en-US,PT40S,40,Data Science and Analytics
MpLHMKTolVw,UCUMZ7gohGI9HcU9VNsr2FJQ,The NBA Data Scientist,17,"News, bloomberg, basketball, 76ers, sports, philadelphia, philly, data science, technology, playoffs, NBA, pro basketball, math",Bloomberg Originals,3650000,512151,13287,0,568,https://www.youtube.com/watch?v=MpLHMKTolVw,en,PT8M6S,486,Data Science and Analytics
y42CzmzMk68,UCh9nVJoWXmFb7sLApWGcLPQ,Your First Data Analytics Project,27,"yt:cc=on, data analytics project ideas, data analytics projects for final year students, data analytics project from scratch, data analytics projects for beginners, data analytics project step by step, data science project ideas for final year, data science project ideas",codebasics,908000,123526,8264,0,37,https://www.youtube.com/watch?v=y42CzmzMk68,en,PT57S,57,Data Science and Analytics
7pXM33cjeU0,UCkw4JCwteGrDHIsyIIKo4tQ,Big Data Analytics | Big Data Analytics Use-Cases | Big Data Tutorial | Edureka Rewind,27,"yt:cc=on, Big Data Analytics, Big Data Analytics for Beginners, Big Data Analytics tutorial, Big Data Analytics tutorial for beginners, What is Big Data, Big Data Explained, Big Data Analytics tools, Big Data Analytics applications, Big Data Analytics Career, Big Data Analytics Example, Big Data Analytics Explained, Big Data Tutorial, Big Data Tutorial for beginners, Big Data Certification, hadoop edureka, big data training, hadoop training, big data edureka, edureka",edureka!,3900000,774,10,0,0,https://www.youtube.com/watch?v=7pXM33cjeU0,en,PT36M39S,2199,Data Science and Analytics
juZ_Bb9Bpxs,UCsvqVGtbbyHaMoevxPAq9Fg,Data Scientist vs Data Analyst | Difference Between Data Scientist And Data Analyst | Simplilearn,27,"data scientist vs data analyst, difference between data scientist and data analyst, data analyst roles and responsibilities, data analyst skills, data scientist, data scientist job, data scientist roles and responsibilities, data scientist skills, what is data analytics, what is data science, who is a data analyst, who is a data scientist, data analyst and data scientist difference, data analyst, data analyst career, data analytics, data science simplilearn, simplilearn",Simplilearn,3540000,15126,292,0,43,https://www.youtube.com/watch?v=juZ_Bb9Bpxs,en,PT12M27S,747,Data Science and Analytics
aYorBPF05Rw,UCJQJAI7IjbLcpsjWdSzYz0Q,How I'd Learn to Become a Data Analyst,22,"data analytics, data science, python, data, tableau, bi, programming, technology, coding, data visualization, python tutorial, data analyst, data scientist, data analysis, power bi, python data anlysis, data nerd, big data, learn to code, business intelligence, how to use r, r data analysis, vscode",Thu Vu data analytics,181000,299861,17748,0,67,https://www.youtube.com/watch?v=aYorBPF05Rw,en-US,PT48S,48,Data Science and Analytics
zB0Ap_SlVao,UCh9nVJoWXmFb7sLApWGcLPQ,Future of data science jobs,27,"data science course, data science, data science for beginners, data science job, data science jobs, future of data science, future of data science jobs, future scope of data science, data science career, data scientist jobs, data scientist, data scientist career",codebasics,908000,146293,7621,0,104,https://www.youtube.com/watch?v=zB0Ap_SlVao,en,PT50S,50,Data Science and Analytics
X3paOmcrTjQ,UCsvqVGtbbyHaMoevxPAq9Fg,Data Science In 5 Minutes | Data Science For Beginners | What Is Data Science? | Simplilearn,27,"data science, what is data science, data science for beginners, data scientist, data science tutorial, data science in 5 minutes, what is data science for beginners, data science applications, introduction to data science, data science with python, what does data scientist do, A Day In The Life Of A Data Scientist, data science explained, learn data science, data science tutorial for beginners, data science 101, simplilearn data science, simplilearn",Simplilearn,3540000,3763913,54148,0,1107,https://www.youtube.com/watch?v=X3paOmcrTjQ,en,PT4M38S,278,Data Science and Analytics
J5RRIF2a1NM,UCLLw7jmFsvfIVaUFsLs8mlQ,How I use SQL as a data analyst,28,"data viz by luke, business intelligence, data science, bi, computer science, data nerd, data analyst, data scientist, how to, data project, data analytics, portfolio project, sql, excel, python, power bi, tableau, data engineer",Luke Barousse,398000,129458,7781,0,65,https://www.youtube.com/watch?v=J5RRIF2a1NM,en-US,PT38S,38,Data Science and Analytics
4Dx4pTjblD4,UCn1USB9-5UqKJTSHd1JGcVw,Data Analytics vs Data Science 🔥 #dataanalytics #datascience #sql,27,"data analytics projects, what is data science, what are data science skills, data science full course, data science, data science for beginners, data science full course in hindi, data science course, data science roadmap, data science project, data analytics career, data analytics roadmap, data analytics project, data analytics interview questions, data analytics vs data science, data science kya hai, data analytics course playlist, power bi, power bi vs tableau, sql",BEPEC by Kanth - #BuildExperience & Get Hired!,59800,28657,1760,0,12,https://www.youtube.com/watch?v=4Dx4pTjblD4,en-IN,PT1M,60,Data Science and Analytics
Lv0xcdeXaGU,UCsvqVGtbbyHaMoevxPAq9Fg,Statistics For Data Science | Data Science Tutorial | Simplilearn,27,"simplilearn, training, tutorial, certification, course, curriculum, Free resources, data science statistics, statistics for data science, statistics introduction, 2017",Simplilearn,3540000,238775,3816,0,71,https://www.youtube.com/watch?v=Lv0xcdeXaGU,en,PT20M17S,1217,Data Science and Analytics
i0B9TSum6bg,UCLLw7jmFsvfIVaUFsLs8mlQ,Day in the life of a Data Analyst 🤓📊,28,"data viz by luke, business intelligence, data science, bi, computer science, data nerd, data analyst, data scientist, how to, data project, data analytics, portfolio project, sql, excel, python, power bi, tableau, data engineer",Luke Barousse,398000,121491,9076,0,77,https://www.youtube.com/watch?v=i0B9TSum6bg,en-US,PT49S,49,Data Science and Analytics
f3FnCoKWmBg,UCzAF54cHk1ZO82af-8E3qOQ,How I'd Learn Data Analytics in 2023 (If I Had to Start Over),27,"data analyst, data analytics, tech jobs 2022, how to learn data analytics, step by step, tech, how to learn data analyst skills, data analytics projects for beginners, how to become a data analyst fast, steps to become a data analyst, data analyst roadmap, data analyst day in the life, data analyst resume, data analyst projects, data analyst career path, data analyst interview, how to become a data analyst, data analytics for beginners, data analytics course",CareerFoundry,230000,717659,25002,0,604,https://www.youtube.com/watch?v=f3FnCoKWmBg,en,PT14M8S,848,Data Science and Analytics
mY4QG8373G4,UCtOiaxdcY_6RsRUpBg_2LoQ,What's the Difference Between Data Science and Analytics?,28,"Analytics experience, data science, analytics, sas, careers, Goutam Chakraborty, Oklahoma State University, Analytics Experience 2016",SAS Software,86200,70110,503,0,42,https://www.youtube.com/watch?v=mY4QG8373G4,en,PT1M56S,116,Data Science and Analytics
roJhUTDJAWU,UCn1USB9-5UqKJTSHd1JGcVw,Who can choose Data Analytics or Data Science Career? #datascience #machinelearning #sql,27,"data, data science, data analytics, machine learning, artificial intelligence, computer, programming, python, what is data science, data science lectures, data science jobs, data science interviews, data science job, tableau, power bi, business analytics, students, freshers, mba, bba, data science full course, data science roadmap, data science career path, data science course, data science kya hai",BEPEC by Kanth - #BuildExperience & Get Hired!,59800,21112,1732,0,14,https://www.youtube.com/watch?v=roJhUTDJAWU,en-IN,PT55S,55,Data Science and Analytics
TeZVQ9hsgTM,UCLLw7jmFsvfIVaUFsLs8mlQ,How to get Data Analytics side jobs - NEW LinkedIn Feature,28,"data viz by luke, business intelligence, data science, bi, computer science, data nerd, data analyst, data scientist, how to, data project, data analytics, LinkedIn, side hustles, side gigs, gigs, side jobs, business analytics",Luke Barousse,398000,106617,6262,0,31,https://www.youtube.com/watch?v=TeZVQ9hsgTM,en-US,PT37S,37,Data Science and Analytics
q9oAZwhuUy4,UCh9nVJoWXmFb7sLApWGcLPQ,Data Analyst vs Data Engineer vs Data Scientist,27,"data engineer vs data analyst, data scientist vs data analyst, data specialist vs data analyst, data analyst vs data scientist, data science vs data analytics, data analytics vs data science, data engineer vs data scientist, data analyst vs data engineer, data analyst vs data scientist vs data engineer, data engineer vs data analyst vs data scientist, difference between data science and data analytics, data analyst vs data engineer vs data scientist, data engineer",codebasics,908000,169254,5106,0,276,https://www.youtube.com/watch?v=q9oAZwhuUy4,en,PT10M52S,652,Data Science and Analytics
8Us6KNzuMYo,UCzAF54cHk1ZO82af-8E3qOQ,How Long Does It Take To Learn Data Analytics?,27,"data analyst, data analytics, how to become a data analyst, how to learn data analytics, data analyst skills, data analyst job, how to learn data analyst skills, data analyst roadmap, data analytics career, data analyst interview, data analyst day in the life, data analyst beginner, data analyst career, data analytics roadmap, how to become a data analyst fast, data analytics project, data analyst skills required, data analytics interview questions",CareerFoundry,230000,115720,5655,0,54,https://www.youtube.com/watch?v=8Us6KNzuMYo,en,PT1M,60,Data Science and Analytics
