GE-T1o-6zUM,UCsvqVGtbbyHaMoevxPAq9Fg,Cyber Security Course | Learn Cyber Security In One Video | Cyber Security Training | Simplilearn,27,"cyber security course, learn cyber security in one video, cybersecurity, cyber security, cyber security full course, learn cyber security course free, cyber security training for beginners, cyber security career, cyber security tutorial for beginners, cyber security tutorial, learn cyber security from scratch, what is cyber security, cyber security training, cyber attacks, hacking, phishing, ddos attack, network security, firewall, comptia, ceh, cyber security simplilearn, simplilearn",Simplilearn,3540000,90175,3154,0,31,https://www.youtube.com/watch?v=GE-T1o-6zUM,en,PT11H36M51S,41811,Cybersecurity Basics
aP8yrkkLWlM,UCYLR1ghzYNyvfjw78raCuxA,Cybersecurity Expert Demonstrates How Hackers Easily Gain Access To Sensitive Information,24,"season 18, smart home, cyberstalking, hacking, cybersecurity, dr.phil, Series, Phil, Show, Self, News, McGraw, Daytime, Help, drphil, Illness, Robin, Doctors, Talk, jay, instagram, Host, dr., Psychologist, Mental, Tv, Mustache, mom, dad, Divorce, Dr Phil Show, Dr. Phil Show, dr. phil, dr phil full episodes, Family, Crime",Dr. Phil,6230000,3164881,58887,0,2294,https://www.youtube.com/watch?v=aP8yrkkLWlM,en,PT3M27S,207,Cybersecurity Basics
kfA-htehOaA,UCB88yR5AsiIfNGjsfvjCn1A,2023 Cybersecurity Full roadmap: How to get started as a beginner?,28,"cybersecurity careers, career in cybersecurity, it security training, cyber security jobs, best it certifications, tech careers, cyber security training for beginners, it security career, cyber security careers, cybersecurity jobs, getting into cyber security, cybersecurity for beginners, it security, highest paying certifications, ethical hacking, cyber security training, infosec careers, entry level cyber security, cyber security analyst, cyber security degree, IT Basics",Nicole Enesse ,54300,292163,10818,0,507,https://www.youtube.com/watch?v=kfA-htehOaA,Unknown,PT13M3S,783,Cybersecurity Basics
wu5H87eU5YU,UC5qEPWtHLFRIjhW_3xd5g2A,Cybersecurity for Beginners | Cyber Security Training for Beginners: What is Cybersecurity 101,28,"Cybersecurity for Beginners, Cyber Security Training for Beginners, Cyber security for Beginners, CyberSecurity Training for Beginners, What is Cyber security, What is Cybersecurity, cyber security career, cybersecurity career, how to get into cybersecurity, working in cybersecurity, cybersecurity analyst, cyber security analyst, beginner in cybersecurity, cyber security entry level, entry level cybersecurity, beginner cybersecurity, beginner cyber security, cybersecurity",Sandra - Tech & Lifestyle,78300,30679,824,0,80,https://www.youtube.com/watch?v=wu5H87eU5YU,en-US,PT13M56S,836,Cybersecurity Basics
JajIG4buJRw,UCqyBfm_H9ugGirk1ufYA2YA,Cybersecurity for Beginners Tutorial,27,"Security Tutorial, Cybersecurity Beginners, Cybersecurity Beginners Tutorial, Tutorial, Cybersecurity Tutorial, Stay safe online, How to stay safe online, Cybersecurity for End Users, Enduser Cybersecurity, Cybersecurity Endusers Tutorial",Learnit Training,616000,35542,512,0,16,https://www.youtube.com/watch?v=JajIG4buJRw,en,PT49M11S,2951,Cybersecurity Basics
lYvijnPI1Rg,UCAndnmvdiphDqLLDrGnBuhA,Networking For Cybersecurity | What you NEED to know,22,N/A,Ryan John,113000,33112,993,0,31,https://www.youtube.com/watch?v=lYvijnPI1Rg,Unknown,PT10M40S,640,Cybersecurity Basics
D0BF5JuC6Mw,UC5qEPWtHLFRIjhW_3xd5g2A,The Best FREE Cyber Security Courses for Beginners,28,"cybersecurity resources for beginners, beginner cybersecurity resources, cyber security resources for beginners, beginner cyber security resources, information security resources, cyber security tools for beginners, cybersecurity tools for beginners, best cybersecurity resources for beginners, best cybersecurity resources for beginners 2022, Best Free Cyber Security Courses, Best Free Cyber Security Courses 2022, Best Free Cyber Security Resources, Best Free Cyber Security Training",Sandra - Tech & Lifestyle,78300,138419,10134,0,99,https://www.youtube.com/watch?v=D0BF5JuC6Mw,en-US,PT26S,26,Cybersecurity Basics
S8cfPitAoTU,UCaHkTRmohpXdnxdvuywjxvA,3 Things I Wish I Knew. DO NOT Go Into Cyber Security Without Knowing!,28,N/A,Cyber Tom,15500,296140,8334,0,892,https://www.youtube.com/watch?v=S8cfPitAoTU,Unknown,PT10M59S,659,Cybersecurity Basics
0qufNK7Dzjc,UCB88yR5AsiIfNGjsfvjCn1A,2023 Top Skills For Getting Into Cybersecurity | Full Roadmap,28,"cyber security, cybersecurity for beginners, cyber security career, information security, cybersecurity jobs, cyber security training, cyber security careers, cybersecurity roadmap 2023, cyber security vs software engineering, cyber security salary, cyber security engineer, cybersecurity roadmap for beginners, cyber security for beginners, cyber security analyst, kali linux, course careers cyber security, cybersecurity careers tamil, cybersecurity careers explained",Nicole Enesse ,54300,41049,1988,0,109,https://www.youtube.com/watch?v=0qufNK7Dzjc,en-US,PT15M16S,916,Cybersecurity Basics
_IOZ8_cPgu8,UC1RauiosDyz3K16X1wkaeiA,"Networking basics (2023) | What is a switch, router, gateway, subnet, gateway, firewall & DMZ",27,"networking tutorial for beginners, networking fundamentals, networking basics, what is router, what is subnetting, what is the difference between router and switch, how firewalls work, what is gateway, how switch works in networking, what is dmz, demilitarized zone network, demilitarized zone, default gateway, demilitarized zone explained, what is dmz in computing, local area network explained, cloud networking, intro to networking, computer networking, networking",IT k Funde,391000,4616234,130630,0,3319,https://www.youtube.com/watch?v=_IOZ8_cPgu8,en,PT14M58S,898,Cybersecurity Basics
FPb19YINif4,UCmTS2gGo4gjZLt8LxVnF3XA,3 Things I Wish I Knew. DO NOT Go Into CyberSecurity Without Knowing!,28,"#cybersecurity, #cybersecurityawareness, #cybersecuritytraining, #cybersecurityexpert, #cybersecurityengineer, #cybersecuritytips, #cybersecuritymonth, #cybersecuritythreats, #cybersecurityjobs, #cybersecuritymajor, resume, how to get a cyber job, #tech, mindset, tech career, tech industry, tech skills, job opportunities, career growth, professional development, latest tech trends, #Cybersecurity, #Career, #Tips, #Mistakes, #Learning, #Certifications, #Success, #Industry, #Inside scoop, #Journey.",Boyd Clewis: The Six-Figure Tech Career Coach,141000,50042,2360,0,85,https://www.youtube.com/watch?v=FPb19YINif4,Unknown,PT9M28S,568,Cybersecurity Basics
VijCUXo8VkQ,UCI-VFjaZ5bJZHa-T8EAPQqA,Cybersecurity Basics,25,N/A,Vizo Financial,1550,1773,17,0,0,https://www.youtube.com/watch?v=VijCUXo8VkQ,en,PT5M54S,354,Cybersecurity Basics
EKdZutMkmTE,UCsvqVGtbbyHaMoevxPAq9Fg,🔥 Complete Cyber Security Course For 2023 | Cyber Security Full Course for Beginners | Simplilearn,27,"cyber security full course, cyber security full course for beginners, cyber security full course for beginners 2023, cyber security training for beginners, cyber security, cyber security course, cyber security complete course, cyber security tutorial, cyber security projects, learn cyber security, learn cyber security from scratch, cybersecurity, learn cyber security step by step, cybersecurity for beginners, cybersecurity course, ethical hacking, simplilearn",Simplilearn,3540000,79739,1636,0,13,https://www.youtube.com/watch?v=EKdZutMkmTE,en,PT11H26M47S,41207,Cybersecurity Basics
dtnsIZhc20E,UC5qEPWtHLFRIjhW_3xd5g2A,Is cyber security hard for beginners?,28,N/A,Sandra - Tech & Lifestyle,78300,286898,12538,0,171,https://www.youtube.com/watch?v=dtnsIZhc20E,en-US,PT45S,45,Cybersecurity Basics
L4lN4pFiyDw,UC5qEPWtHLFRIjhW_3xd5g2A,How to Learn Cyber Security FAST using ChatGPT as a Beginner: Using ChatGPT To Learn Cybersecurity,28,"How to Use ChatGPT to Learn Cyber Security as a Beginner, how i use chatgpt to learn cyber security as a beginner, how to use chatgpt to learn cybersecurity, using chatgpt to learn cyber security, How I Would Learn Cyber security with ChatGPT, how i would use chatgpt to learn cyber security, how to use chatgpt to learn cyber security, use chatgpt to learn cyber security, How to Learn CyberSecurity FAST using ChatGPT as a Beginner, Using ChatGPT To Learn Cyber security, chatgpt",Sandra - Tech & Lifestyle,78300,22028,701,0,38,https://www.youtube.com/watch?v=L4lN4pFiyDw,en-US,PT15M11S,911,Cybersecurity Basics
JgWQAPNNJ8k,UCTLUi3oc1-a7dS-2-YgEKmA,"What You Should Learn Before ""Cybersecurity""",22,"cybersecurity, Cyber Security, Cyber security, infosec, information security, how to start a career in cybersecurity, information technology, cyber security, information systems, student in cybersecurity, entry-level cybersecurity careers",Grant Collins,186000,242767,9129,0,416,https://www.youtube.com/watch?v=JgWQAPNNJ8k,Unknown,PT10M13S,613,Cybersecurity Basics
IXhLVORrr3A,UC8lIGbogm1jbSnD4HyNbooA,Complete CYBER SECURITY Roadmap 😎,22,"cyber security road map, road map, cyber sec, cybersecurity, cyber security, motivation, cryptoknight, cryptoknight video, cyber road map, security engineer, bug bounty hunter, red team, pentest, how to become a bug bounty hunter, roadmap for cyber security, complete guide for cyber security, cyber security guide, cryptoknight latest video, cyber security in India",CryptoKnight,120000,134058,6473,0,223,https://www.youtube.com/watch?v=IXhLVORrr3A,en,PT8M48S,528,Cybersecurity Basics
GT0daScxO18,UCkw4JCwteGrDHIsyIIKo4tQ,What is Cybersecurity? | Cybersecurity in 2 Minutes | Cybersecurity Online Training | Edureka,27,"yt:cc=on, Cyber Security, cybersecurity, What is Cyber Security, What is CyberSecurity, cyber security tutorial, cyber security training, cybersecurity for beginners, introduction to Cyber Security, cyber security in 2 minutes, cybersecurity fundamentals, cyber security basics, cyber security course, cybersecurity 101, edureka cyber security, Edureka, cybersecurity edureka, cybersecurity training, cyber security explained, cyber security use cases, cyber security career",edureka!,3900000,103671,1226,0,11,https://www.youtube.com/watch?v=GT0daScxO18,en,PT2M26S,146,Cybersecurity Basics
mS7qWC3CbOU,UCP7WmQ_U4GB3K51Od9QvM0w,2022 Cybersecurity roadmap: How to get started?,28,"cyber security, cybersecurity for beginners, cybersecurity careers, cyber security course, david bombal, davidbombal, john hammond, ethical, ethical hacking, information security, careers in cybersecurity, cyber security jobs, cyber security career, cyber security training, cybersecurity jobs, getting into cyber security, hacker, hacking, ceh, ejpt, hack the box, ctf, try hack me, hackthebox, tryhackme, ine, ethical hacker, career in cybersecurity, kali linux, cyber security careers",David Bombal,2260000,904849,32281,0,1069,https://www.youtube.com/watch?v=mS7qWC3CbOU,en-GB,PT25M22S,1522,Cybersecurity Basics
kGPCUvZZ6FM,UCT-0Lw1AytpgikOiEwLvLZw,Cybersecurity Basics for Small Business | Federal Trade Commission,27,"Federal Trade Commission, small business, cybersecurity, basics, cybersecurity basics",FTCvideos,31800,13090,134,0,20,https://www.youtube.com/watch?v=kGPCUvZZ6FM,en,PT1M29S,89,Cybersecurity Basics
mhPzvcpDcsA,UCsvqVGtbbyHaMoevxPAq9Fg,🔥 Cybersecurity Course For Beginners 2023 | Cyber Security Full Course 2023 | Simplilearn,27,N/A,Simplilearn,3540000,13825,200,0,5,https://www.youtube.com/watch?v=mhPzvcpDcsA,en,PT8H47M38S,31658,Cybersecurity Basics
utrSLGooMCM,UCRAxwkquV9-2NK5bmS_IHAQ,Cybersecurity Basics: What is Endpoint Protection?,28,N/A,Malwarebytes,26100,2471,27,0,4,https://www.youtube.com/watch?v=utrSLGooMCM,en,PT1M5S,65,Cybersecurity Basics
kOcFjJIGr9I,UCEyCubIF0e8MYi1jkgVepKg,Best book to start learning hacking with #hacking #cybersecurity #hack #books,27,"hacking books, hack, hacker, hacking, python, python hacking, black hat python, gray hat hacking, linux, linux for hackers, bug bounty, nsa, nsa hacker, nsa hacking, ethical hacking, ceh, oscp, ine, try hack me, hack the box, ethical hacker, oscp certification, ctf for beginners",David Bombal Shorts,12300,28540,2132,0,11,https://www.youtube.com/watch?v=kOcFjJIGr9I,en,PT35S,35,Cybersecurity Basics
ukzFI9rgwfU,UCsvqVGtbbyHaMoevxPAq9Fg,Machine Learning | What Is Machine Learning? | Introduction To Machine Learning | 2021 | Simplilearn,27,"machine learning, basics of machine learning, what is machine learning, introduction to machine learning, Machine Learning, machine learning with gcp, gcp maching learning, cloud and machine learning, ML, fundamentals of machine learning, machine learning basics, getting started with machine learning, machine learning for beginners, machine learning tutorial for beginners, simplilearn machine learning, simplilearn, 2022, 2023",Simplilearn,3540000,4164816,52116,0,2102,https://www.youtube.com/watch?v=ukzFI9rgwfU,en,PT7M52S,472,Machine Learning Fundamentals
EuBBz3bI-aA,UCtYLUTtgS3k1Fg4y5tAhLbw,Machine Learning Fundamentals: Bias and Variance,27,"Joshua Starmer, StatQuest, Machine Learning, Bias, Variance, Statistics, Data Mining, Clearly Explained, Data Science",StatQuest with Josh Starmer,1060000,1139854,32530,0,1353,https://www.youtube.com/watch?v=EuBBz3bI-aA,en,PT6M36S,396,Machine Learning Fundamentals
yN7ypxC7838,UCF-uUxo43IPpnEwnR62WGlA,All Machine Learning Models Explained in 5 Minutes | Types of ML Models Basics,27,"machine learning models, machine learning models explained, machine learning, ml models explained, machine learning models basics, example, supervised learning, machine learning models for beginners, machine learning models overview, machine learning models from scratch, ml models basics, regression, unsupervised learning, classification, beginners, basics, overview, types of ml models, basics of machine learning models",Learn with Whiteboard,61200,1046304,26009,0,380,https://www.youtube.com/watch?v=yN7ypxC7838,en,PT5M1S,301,Machine Learning Fundamentals
cfSDvPlFFVQ,UCsvqVGtbbyHaMoevxPAq9Fg,Machine Learning | What Is Machine Learning? | Machine Learning Basics | 2023 | Simplilearn,27,"machine learning in 2 minutes, what is machine learning?, introduction to machine learning, machine learning explained in 2 minutes, what is machine learning and how does it work, need for ml, machine learning for beginners, getting started with machine learning, learn machine learning, machine learning course, machine learning algorithms, types of machine learning, supervised learning, unsupervised learning, machine learning basics, deep learning, machine learning simplilearn",Simplilearn,3540000,118763,2162,0,23,https://www.youtube.com/watch?v=cfSDvPlFFVQ,en,PT1M56S,116,Machine Learning Fundamentals
i_LwzRVP7bg,UC8butISFwT-Wl7EV0hUK0BQ,Machine Learning for Everybody – Full Course,27,N/A,freeCodeCamp.org,8820000,3103819,45864,0,850,https://www.youtube.com/watch?v=i_LwzRVP7bg,en,PT3H53M53S,14033,Machine Learning Fundamentals
4RixMPF4xis,UCKWaEZ-_VweaEx1j62do_vQ,AI vs Machine Learning,27,"IBM, IBM Cloud, ai, artificialintelligence, artificial intelligence, ML, machinelearning, machine learning, deep learning, deeplearning",IBM Technology,610000,635238,21092,0,494,https://www.youtube.com/watch?v=4RixMPF4xis,en-US,PT5M49S,349,Machine Learning Fundamentals
h0e2HAPTGF4,UCEBb1b_L6zDS3xTUrIALZOw,11. Introduction to Machine Learning,27,"machine learning, classification method, Minkowski metric, supervised learning, computer modelling, signal-to-noise, feature vectors, classification model, regression model",MIT OpenCourseWare,4880000,1580762,22743,0,438,https://www.youtube.com/watch?v=h0e2HAPTGF4,en,PT51M31S,3091,Machine Learning Fundamentals
PeMlggyqz0Y,UCsBjURrPoezykLs9EqgamOA,Machine Learning Explained in 100 Seconds,28,"webdev, app development, lesson, tutorial",Fireship,2670000,451957,23531,0,429,https://www.youtube.com/watch?v=PeMlggyqz0Y,en,PT2M35S,155,Machine Learning Fundamentals
A3DLSuvgCps,UCMz_Y-vstQ115cj44alxsgQ,1. Google Cloud Seekho Season 5: GenAI Version | Learn Google Cloud And Win Goodies | Pakistan,27,N/A,Developer Faiz M Shah,1060,183,6,0,9,https://www.youtube.com/watch?v=A3DLSuvgCps,en-US,PT10M33S,633,Machine Learning Fundamentals
O5xeyoRL95U,UCSHZKyawb77ixDdsGog4iWA,Deep Learning Basics: Introduction and Overview,28,"deep learning, machine learning, computer vision, tensorflow, deepmind, openai, mit, introduction, basics, lex fridman, mit deep learning, deep learning mit, deep learning tutorial, deep learning basics, intro to deep learning, introduction to deep learning, what is deep learning, deep learning basics mit, basics of deep learning, tensorflow tutorial, deep learning python, deep learning andrew ng, deep learning tensorflow, intro to machine learning, deep learning introduction",Lex Fridman,3510000,2217804,41890,0,859,https://www.youtube.com/watch?v=O5xeyoRL95U,en,PT1H8M6S,4086,Machine Learning Fundamentals
NWONeJKn6kc,UC8butISFwT-Wl7EV0hUK0BQ,Machine Learning Course for Beginners,27,N/A,freeCodeCamp.org,8820000,1513721,47386,0,1290,https://www.youtube.com/watch?v=NWONeJKn6kc,en,PT9H52M19S,35539,Machine Learning Fundamentals
Kdsp6soqA7o,UCtYLUTtgS3k1Fg4y5tAhLbw,Machine Learning Fundamentals: The Confusion Matrix,27,"Josh Starmer, StatQuest, Statistics, Machine Learning, Cross Validation, Confusion Matrix",StatQuest with Josh Starmer,1060000,578926,13797,0,629,https://www.youtube.com/watch?v=Kdsp6soqA7o,en,PT7M13S,433,Machine Learning Fundamentals
G7fPB4OHkys,UCsvqVGtbbyHaMoevxPAq9Fg,Machine Learning Tutorial | Machine Learning Basics | Machine Learning Algorithms | Simplilearn,27,"machine learning tutorial, machine learning tutorial for beginners, machine learning basics, data science tutorial, machine learning with python, machine learning algorithms, machine learning tutorial python, machine learning in python, data science for beginners, python machine learning, python machine learning tutorial, introduction to machine learning, what is machine learning, machine learning training, machine learning projects, simplilearn, simplilearn machine learning",Simplilearn,3540000,205267,2635,0,125,https://www.youtube.com/watch?v=G7fPB4OHkys,en,PT34M52S,2092,Machine Learning Fundamentals
wtolixa9XTg,UCtatfZMf-8EkIwASXM4ts0A,How I would learn Machine Learning (if I could start over),22,N/A,AssemblyAI,108000,650229,28515,0,449,https://www.youtube.com/watch?v=wtolixa9XTg,Unknown,PT7M43S,463,Machine Learning Fundamentals
olFxW7kdtP8,UCsvqVGtbbyHaMoevxPAq9Fg,Types Of Machine Learning | Machine Learning Algorithms | Machine Learning Tutorial | Simplilearn,27,"types of machine learning, machine learning types, machine learning algorithms, machine learning algorithms explained, machine learning types with examples, machine learning algorithms tutorial, machine learning tutorial, machine learning tutorial for beginners, decision tree algorithm, linear regression algorithm, logistic regression algorithm, k nearest neighbors, naive bayes, machine learning, simplilearn machine learning, simplilearn, ml algorithms, ml algorithms types, ml",Simplilearn,3540000,200846,3717,0,69,https://www.youtube.com/watch?v=olFxW7kdtP8,en,PT21M9S,1269,Machine Learning Fundamentals
hjh1ikznScg,UCkw4JCwteGrDHIsyIIKo4tQ,Machine Learning Basics | What Is Machine Learning? | Introduction To Machine Learning | Edureka,27,"yt:cc=on, machine learning basics, machine learning basics for beginners, what is machine learning, introduction to machine learning, machine learning tutorial, machine learning tutorial for beginners, what is machine learning and how does it work, supervised and unsupervised learning, reinforcement learning, machine learning example, machine learning examples in real life, machine learning applications, machine learning algorithms, edureka machine learning, edureka",edureka!,3900000,136548,2075,0,33,https://www.youtube.com/watch?v=hjh1ikznScg,en,PT14M14S,854,Machine Learning Fundamentals
JxgmHe2NyeY,UCNU_lfiiWBdtULKOw6X0Dig,Complete Machine Learning In 6 Hours| Krish Naik,27,"yt:cc=on, complete machine learning algorithms, AI Vs ML vs DL vs Data Science, Regression And Classification, Linear Regression Algorithm, Logistic Regression Algorithm, Linear Regression Practical Implementation, Ridge And Lasso Regression Practical Implementation, Naive Baye's Algorithms, Decision Tree Classification Algorithms, Hierarichal Clustering Algorithms, Silhoutte Clustering, krish naik complete machine learning playlist",Krish Naik,855000,533010,10977,0,258,https://www.youtube.com/watch?v=JxgmHe2NyeY,en,PT6H37M52S,23872,Machine Learning Fundamentals
Pj0neYUp9Tc,UCkw4JCwteGrDHIsyIIKo4tQ,What is Machine Learning? | Machine Learning Basics | Machine Learning Tutorial | Edureka,27,"yt:cc=on, what is Machine Learning, Machine Learning basics, Machine Learning tutorial, Machine Learning, Machine Learning tutorial for beginners, introduction to Machine Learning, Machine Learning algorithms, Machine Learning with python, machine learning training, artificial intelligence, deep learning, tensorflow, Machine Learning examples, learn Machine Learning, Machine Learning fundamentals, edureka machine learning, edureka, machine learning course",edureka!,3900000,308275,4135,0,105,https://www.youtube.com/watch?v=Pj0neYUp9Tc,en,PT17M21S,1041,Machine Learning Fundamentals
fSytzGwwBVw,UCtYLUTtgS3k1Fg4y5tAhLbw,Machine Learning Fundamentals: Cross Validation,27,"Josh Starmer, StatQuest, Machine Learning, Cross Valdiation, Statistics, Data Science",StatQuest with Josh Starmer,1060000,959905,29002,0,1425,https://www.youtube.com/watch?v=fSytzGwwBVw,en,PT6M5S,365,Machine Learning Fundamentals
q6kJ71tEYqM,UCKWaEZ-_VweaEx1j62do_vQ,Machine Learning vs Deep Learning,27,N/A,IBM Technology,610000,429093,14283,0,150,https://www.youtube.com/watch?v=q6kJ71tEYqM,en-US,PT7M50S,470,Machine Learning Fundamentals
k2P_pHQDlp0,UCNU_lfiiWBdtULKOw6X0Dig,AI VS ML VS DL VS Data Science,27,"Artificial Intelligence, Machine Learning, Deep Learning, Data Science",Krish Naik,855000,2721574,65494,0,1709,https://www.youtube.com/watch?v=k2P_pHQDlp0,en,PT9M45S,585,Machine Learning Fundamentals
9gGnTQTYNaE,UCKWaEZ-_VweaEx1j62do_vQ,What is Machine Learning?,28,"Machine Learning, Deep Learning, AI, Artificial Intelligence, supervised learning, unsupervised learning, Neural Networks, cloud computing, IBM, IBM Cloud, IBM Watson",IBM Technology,610000,122747,2363,0,43,https://www.youtube.com/watch?v=9gGnTQTYNaE,en-US,PT8M23S,503,Machine Learning Fundamentals
Av0oMG49FQE,UCkRFwipiIqBTakN-mkZ-GcQ,Machine Learning Roadmap for Beginners,27,"ayush singh, ayush, youngest ml engineer, youngest data scientist, machine learning roadmap, ml roadmap, data science roadmap, coding, computer programming",Ayush Singh,65800,370873,13976,0,480,https://www.youtube.com/watch?v=Av0oMG49FQE,en-IN,PT6M54S,414,Machine Learning Fundamentals
aircAruvnKk,UCYO_jab_esuFRV4b17AJtAw,"But what is a neural network? | Chapter 1, Deep learning",27,"three brown one blue, 3 brown 1 blue, neural networks, three blue one brown, 3 blue 1 brown, machines learning, 3brown1blue, 3b1b, deep learning, one, Mathematics, blue, three, brown",3Blue1Brown,5730000,15016956,374848,0,6970,https://www.youtube.com/watch?v=aircAruvnKk,en,PT18M40S,1120,Machine Learning Fundamentals
I2ZK3ngNvvI,UCJIfeSCssxSC_Dhc5s7woww,Advice for machine learning beginners | Andrej Karpathy and Lex Fridman,28,"ai, ai clips, ai podcast, ai podcast clips, andrej karpathy, artificial intelligence, artificial intelligence podcast, computer science, consciousness, deep learning, einstein, elon musk, engineering, friedman, joe rogan, lex ai, lex clips, lex fridman, lex fridman podcast, lex friedman, lex mit, lex podcast, machine learning, math, math podcast, mathematics, mit ai, philosophy, physics, physics podcast, science, tech, tech podcast, technology, turing",Lex Clips,1120000,643368,19210,0,471,https://www.youtube.com/watch?v=I2ZK3ngNvvI,en-US,PT5M48S,348,Machine Learning Fundamentals
7eh4d6sabA0,UCWv7vMbMWH4-V0ZXdmDpPBA,Python Machine Learning Tutorial (Data Science),27,"machine learning python, machine learning tutorial, machine learning, python, python tutorial, jupyter notebook, data science, python data science, python tutorial advanced, data science python, python machine learning, artificial intelligence, programming with mosh, mosh hamedani, code with mosh, jupyter, machine learning tutorial for beginners, machine learning with python, data science tutorial, machine learning course, python programming, introduction to machine learning",Programming with Mosh,3680000,2479429,57396,0,1651,https://www.youtube.com/watch?v=7eh4d6sabA0,en,PT49M43S,2983,Machine Learning Fundamentals
KjfMPxS2on8,UC_x5XG1OV2P6uZZ5FSM9Ttw,Machine Learning basics,28,"Google, developers, What is machine learning, machine learning crash course, how do computers find patterns, how do you teach a computer, computer parameters machine learning, ml, machine learning basics, basic principles of machine learning, machine learning parameters, google developers, google technology, google devs, google tech, tensorflow, GDS: Yes",Google for Developers,2330000,27733,898,0,47,https://www.youtube.com/watch?v=KjfMPxS2on8,en-US,PT4M43S,283,Machine Learning Fundamentals
9f-GarcDY58,UCsvqVGtbbyHaMoevxPAq9Fg,Machine Learning Full Course | Learn Machine Learning | Machine Learning Tutorial | Simplilearn,27,"machine learning course, machine learning concepts, machine learning tutorial, complete machine learning course, complete machine learning project, machine learning, machine learning algorithms, supervised and unsupervised learning, linear regression machine learning, k- means clustering algorithm, logistic regression machine learning, what is machine learning, what is machine learning and how does it work, machine learning simplilearn, simplilearn, machine learning with python",Simplilearn,3540000,870433,17660,0,4675,https://www.youtube.com/watch?v=9f-GarcDY58,en,PT6H21M33S,22893,Machine Learning Fundamentals
