kAoRS72R2fg,UC8duB8Hk2hEMOMAN1LMABNA,Meet Loretta Bortey - Big Data Technologies,27,N/A,watchgcu,4790,57,0,0,0,https://www.youtube.com/watch?v=kAoRS72R2fg,Unknown,PT1M3S,63,Big Data Technologies
cnJ10_BInoI,UC8w8_H_1uDfi2ftQx7a64uQ,Big Data Tutorial 1 | Big Data Introduction | Big Data Technology | Big Data Characteristics,27,"big, data, tutorial, characteristics, what, is, big data, what is, big data tutorial, what is big data, training, big data training, for beginners, learn, explained, learn big data, big data explained, big data (industry), introduction, types, big data types, definition, big data definition, introduction to big data, overview, big data overview, technology, technologies, characteristics of big data, types of, ppt, types of big data, of big data, its characteristics, five characteristics",Software and Testing Training,78400,1010,30,0,0,https://www.youtube.com/watch?v=cnJ10_BInoI,en,PT12M43S,763,Big Data Technologies
5Q0zqgPY87Q,UC0s5EyfMFRdGuLc5CYzpwMQ,Comp8210- Big Data Technologies,22,N/A,Aysha Makani,0,9,0,0,0,https://www.youtube.com/watch?v=5Q0zqgPY87Q,Unknown,PT10M36S,636,Big Data Technologies
cq7zZwVfiiA,UCF8zb4viAzM9VRoDaL78PYw,What's new in Big Data technologies: the next frontier for Hadoop ecosystem,28,"big data, hadoop, yarn, open source, franceschini, engineering, spagobi, spagoworld, hadoop summit, map reduce, hdfs, apache storm, nosql, busines intelligence, analytics, Software, Apache Hadoop (Software), Data",ItalyMadeOpenSource,503,4142,7,0,1,https://www.youtube.com/watch?v=cq7zZwVfiiA,Unknown,PT5M20S,320,Big Data Technologies
7ZHoQoD81RE,UCjH_JKcAGVEOeCZDs4sJbEw,The Big Data technologies,22,N/A,TechneValue,14,3,0,0,0,https://www.youtube.com/watch?v=7ZHoQoD81RE,Unknown,PT3M3S,183,Big Data Technologies
hFvvLYxd9fY,UC1sajxOT0Xo3nakB55zWv-A,1.12 Big Data Landscape - Big Data Emerging Technologies,27,"science and technology, technology, neurological disorder medicines, technology development, biotechnology, european society of cardiology, tiger technicians hour, cardiologists, climate change, tree planting targets, ecology, cardiology, rural and regional patients, government job notification, tech insider, secondhand smoke, long term thinking, smoking cessation",Trudie Dedie,74,60,1,0,0,https://www.youtube.com/watch?v=hFvvLYxd9fY,Unknown,PT1M44S,104,Big Data Technologies
-lVgCXk-rFs,UCvet5nL6P4bquwtH1gmBFsQ,Big Data Technologies (Data Analysis),22,N/A,Proteek Sanyal,0,1,0,0,0,https://www.youtube.com/watch?v=-lVgCXk-rFs,Unknown,PT12M40S,760,Big Data Technologies
RG7R7bIkLxU,UCgXMjFQDpbB8wotnLqyFbhQ,Introducing Big Data Technologies (part 1),22,"#BigData, #GFS, #undergraduatecourse, #UMP, #DataAnalytics",Dr. Data,19,27,2,0,0,https://www.youtube.com/watch?v=RG7R7bIkLxU,en-US,PT26M36S,1596,Big Data Technologies
acimvXoKwhc,UC3BGlwmI-Vk6PWyMt15dKGw,Big Data: Technologies & Techniques for Large-Scale Data (SHORT version),28,"big data, mapreduce, hadoop, sql, key-value, mpp database, stream database, triadic continuum, wavelets, ben lorica, roger magoulas, research, O'Reilly, Tim O'Reilly, O'Reilly Media, OReilly, Tim OReilly, OReilly Media, OReillyMedia, o'reilly, books",O'Reilly,195000,2660,2,0,1,https://www.youtube.com/watch?v=acimvXoKwhc,Unknown,PT9M40S,580,Big Data Technologies
vmOfTNXetSg,UCbQ8VhSuEisYwP-dc762rtg,MiStar Technologies    Big Data   What it Means to You,22,N/A,MitStar Technologies,5,25,1,0,0,https://www.youtube.com/watch?v=vmOfTNXetSg,Unknown,PT1M51S,111,Big Data Technologies
brWTm8Zi6ek,UCLSpcbH3OZPWXOcDuOXqqPg,Insight into Virtual Currency Ecosystems by making use of Big Data Technology,28,"big data, bitcoin, block chain, bde, cessda",Big Data Europe,187,419,3,0,0,https://www.youtube.com/watch?v=brWTm8Zi6ek,Unknown,PT51M44S,3104,Big Data Technologies
pyPn1SRjyZM,UC3pWTDnti4lcVhEa3BNVhHw,Complete Overview on Big Data Technologies |  Webinar Series _ Part:01,27,"importance of business analytics, data analytics courses, data analytics tools, big data analytics, data analytics jobs, data analytics vs data science, data analytics tutorial, data science, data scientist, big data tutorial, Big data tech, #bigdatatutorial, Big Da, business analyst, big data hadoop tutorial for beginners",Emerging India Analytics,200,74,3,0,0,https://www.youtube.com/watch?v=pyPn1SRjyZM,Unknown,PT30M,1800,Big Data Technologies
a0KjalbzkpQ,UCZxciISwRs_qRuLIIgcg6Xw,Big Data Big Issues E08: FISA and Big Data Technologies,28,N/A,Big Data Big Issues,17,9,0,0,0,https://www.youtube.com/watch?v=a0KjalbzkpQ,Unknown,PT37M32S,2252,Big Data Technologies
5-oiLKEWIEw,UClLXKYEEM8OBBx85DOa6-cg,Best Programming Languages #programming #coding #javascript,28,N/A,Devslopes,242000,2300991,74231,0,1817,https://www.youtube.com/watch?v=5-oiLKEWIEw,en,PT16S,16,"Advanced Programming Languages (e.g., C++, Java)"
wvqbKGZOSVg,UCWI-ohtRu8eEeDj93hmUsUQ,The 5 most HATED programming languages 👩‍💻 #programming #technology #software #career,28,N/A,Coding with Lewis,483000,1930962,75705,0,1698,https://www.youtube.com/watch?v=wvqbKGZOSVg,Unknown,PT51S,51,"Advanced Programming Languages (e.g., C++, Java)"
HYJZ0CYw3hk,UCBwmMxybNva6P_5VmxjzwqA,3 Coding Languages for 2022,27,"C++, C++ coding, C++ full course, C++ placement course, how to code, programming, college placement course, C++ language, java, java language, java full course, java placement, java code, java coding",Apna College,4660000,4179937,415059,0,1563,https://www.youtube.com/watch?v=HYJZ0CYw3hk,Unknown,PT41S,41,"Advanced Programming Languages (e.g., C++, Java)"
BkzPdgdxWBY,UCkcqmxjMXaBb0kDWqqSEU1g,Stop Learning These Programming Languages (as a beginner),28,"how to learn coding, how to become a software engineer, how to learn programming, how to learn coding for beginners, how to learn programming for beginners, how to learn coding fast, how to become a software developer, how to get software engineer job, how to get software developer job, how to learn to code, coding, coding interview, python, java, web development, leetcode, math for programmers, programming, software engineer",Power Couple,514000,496462,8904,0,609,https://www.youtube.com/watch?v=BkzPdgdxWBY,en,PT6M27S,387,"Advanced Programming Languages (e.g., C++, Java)"
opRm3x9vHH0,UCWu_xJfwUuP_JV6RFq2EcXw,Programming Language Tier List,28,"coding, software, engineering, software engineering, sde, swe, software development, development, web, web development, developer, tech, frontend developer, web developer, engineer, tier, list, tier list, ranking, ranked, javascript, c++, matlab, php, programming, humor, programming humor, programming meme, programming tier list",Conner Ardman,49100,1696039,53249,0,2874,https://www.youtube.com/watch?v=opRm3x9vHH0,en-US,PT55S,55,"Advanced Programming Languages (e.g., C++, Java)"
eUZdr8o9ULQ,UCkcqmxjMXaBb0kDWqqSEU1g,👩🏻‍💻 How To Decide What Programming Language To Learn,28,"tech jobs, tech careers, tech career, career, career goals, career change, career switch, career advice, women in tech, tech industry, tech company, faang, high paying jobs, programmer, software engineer, coding, programming, technology, tech, jobs, programming languages, cpp, c++, java, python, javascript, which language to learn, which programming language to learn, which coding language to learn, c#, c language, node, django, spring boots, sql, html, css, bootstrap, tailwind, reat, vue, angular",Power Couple,514000,310505,27963,0,312,https://www.youtube.com/watch?v=eUZdr8o9ULQ,en,PT51S,51,"Advanced Programming Languages (e.g., C++, Java)"
AeNs18WuN_A,UCeVMnSShP_Iviwkknt83cww,Top 3 Programming Languages 💻,27,N/A,CodeWithHarry,5210000,904902,89514,0,384,https://www.youtube.com/watch?v=AeNs18WuN_A,hi,PT56S,56,"Advanced Programming Languages (e.g., C++, Java)"
ExexzPc8sY4,UCTXiHVtLmYCRr_xGoWeefqg,Top 10 Programming Languages 2004-2022,27,"best programming language 2022, best first programming language 2022, which language should i learn in 2022, top programming language 2022, top 10 programming languages of all time, python, best programming languages to learn in 2022, top programming languages 2022, most popular programming languages 2022, top 5 programming language to learn in 2022, top 10 most popular programming languages, best programming language, c++, kotlin, go programming, swift, php, javascript",Code Bear,14300,295199,7000,0,215,https://www.youtube.com/watch?v=ExexzPc8sY4,en-GB,PT44S,44,"Advanced Programming Languages (e.g., C++, Java)"
eItVuIz1LlQ,UCbjozK_PYCTLEluFlrJ8UZg,FULLSTACK JAVA BY NAGOOR  SIR,27,"durga, durga sir, durgasoft, interview, questions, java, software, training",Durga Software Solutions,808000,201,11,0,2,https://www.youtube.com/watch?v=eItVuIz1LlQ,en,PT1H40M37S,6037,"Advanced Programming Languages (e.g., C++, Java)"
14BL_FwQCpM,UCkcqmxjMXaBb0kDWqqSEU1g,Fastest Way to Learn ANY Programming Language: 80-20 rule,28,"how to learn coding, how to become a software engineer, how to learn programming, how to learn coding for beginners, how to learn programming for beginners, how to learn coding fast, how to become a software developer, how to get software engineer job, how to get software developer job, how to learn to code, coding, coding interview, python, java, web development, leetcode, math for programmers, programming, software engineer",Power Couple,514000,420538,16931,0,367,https://www.youtube.com/watch?v=14BL_FwQCpM,en,PT8M24S,504,"Advanced Programming Languages (e.g., C++, Java)"
8jLOx1hD3_o,UC8butISFwT-Wl7EV0hUK0BQ,C++ Programming Course - Beginner to Advanced,27,N/A,freeCodeCamp.org,8820000,4859945,134436,0,4069,https://www.youtube.com/watch?v=8jLOx1hD3_o,en,P1DT7H7M30S,0,"Advanced Programming Languages (e.g., C++, Java)"
pEfrdAtAmqk,UCsBjURrPoezykLs9EqgamOA,God-Tier Developer Roadmap,28,"webdev, app development, lesson, tutorial",Fireship,2670000,5744693,220500,0,9019,https://www.youtube.com/watch?v=pEfrdAtAmqk,en,PT16M42S,1002,"Advanced Programming Languages (e.g., C++, Java)"
lMvFWKHhVZ0,UC4Cqvm3LRHa2Fuv2m45sIEg,"My 2 Year Journey of Learning C, in 9 minutes",22,N/A,VoxelRifts,10500,439810,14279,0,483,https://www.youtube.com/watch?v=lMvFWKHhVZ0,en,PT8M42S,522,"Advanced Programming Languages (e.g., C++, Java)"
SfwsZ8vlYx0,UCsvqVGtbbyHaMoevxPAq9Fg,"C vs C++ vs Java | Difference Between C, C++ & Java | Programming Languages Comparison | Simplilearn",27,"c vs c++, c vs c++ vs java, differenvce between c c++ and java, c++ and java, java v/s c++, difference between c and c++, difference between c and java, difference between c++ and java, difference between java and c++, platform dependency, origin, preprocessor directives, multithreading, comparison between c and c++, comparison between c and java, c++ and java differences, c and c++, c++ and java comparison, c++ and java difference, simplilearn programming, simplilearn",Simplilearn,3540000,20523,439,0,26,https://www.youtube.com/watch?v=SfwsZ8vlYx0,en-US,PT16M5S,965,"Advanced Programming Languages (e.g., C++, Java)"
v8rsxsSzB1E,UCe1_AimeEKagzcZJFepi1fw,Best books for C++ programming language,27,N/A, CSE BANDA (RANA MOI),378,150047,4882,0,56,https://www.youtube.com/watch?v=v8rsxsSzB1E,Unknown,PT16S,16,"Advanced Programming Languages (e.g., C++, Java)"
RyRo8eVsrlU,UCZ9qFEC82qM6Pk-54Q4TVWA,STOP Learning These Programming Languages (for Beginners),28,N/A,Andy Sterkowitz,347000,539765,13732,0,1658,https://www.youtube.com/watch?v=RyRo8eVsrlU,en,PT5M25S,325,"Advanced Programming Languages (e.g., C++, Java)"
9U684GbFST4,UCRLEADhMcb8WUdnQ5_Alk7g,Top 5 Programming Languages in 2022 to Get a Job,27,"programming, web development, javascript, react, learn programming, learn to code, coding, software development, become a software developer, software developer, freelancing, freelance developer, coding tutorials",Aaron Jack,403000,724848,21001,0,637,https://www.youtube.com/watch?v=9U684GbFST4,en,PT8M41S,521,"Advanced Programming Languages (e.g., C++, Java)"
87SH2Cn0s9A,UC4SVo0Ue36XCfOyb5Lh1viQ,C Programming Full Course for free 🕹️,28,"c tutorial, c course, c programming language, c programming language tutorial, c programming language tutorial for beginners, c programming course, C (Programming Language), Programming Language (Software Genre), tutorial, beginners, programming, examples, language basics, literals, data types, functions, loops, arrays, pointers, structures, For Loop, While Loop, Do While Loop, User Input, If, Switch",Bro Code,1470000,2131000,73219,0,2780,https://www.youtube.com/watch?v=87SH2Cn0s9A,en,PT4H5M,14700,"Advanced Programming Languages (e.g., C++, Java)"
xhJgxJuS4pQ,UCkcqmxjMXaBb0kDWqqSEU1g,Top 5 Coding Languages To Get a Job,28,"coding, software engineer, software engineering, self taught programmer, software developer, programmer, computer science, programming, how to become a software engineer, how to become a software engineer without a degree, google, faang, how to learn programming, how to learn coding, learn to code, self taught software engineer, software engineer no degree, computer science degree, coding bootcamp",Power Couple,514000,1118017,49296,0,623,https://www.youtube.com/watch?v=xhJgxJuS4pQ,en,PT55S,55,"Advanced Programming Languages (e.g., C++, Java)"
TQDHGswF67Q,UC6biysICWOJ-C3P4Tyeggzg,coding in c until I go completely insane,28,"computer science, meme, c programming, computer programming, programmer humor, funny, unsafe, coding with c until, programming for beginners, programming language, programming in c, programming hero, programming fundamentals, programming memes",Low Level Learning,362000,1328749,48017,0,1340,https://www.youtube.com/watch?v=TQDHGswF67Q,en,PT1M15S,75,"Advanced Programming Languages (e.g., C++, Java)"
sNMtjs_wQiE,UCRLHJ-7b4pjDpBBHAUXEvjQ,C vs C++ vs C#,28,"c++, indie games, game development, indie development, code, games, coding, gamedev, developer, tutorials, high level, low level, programming, computer science",conaticus,49200,1531042,66542,0,2361,https://www.youtube.com/watch?v=sNMtjs_wQiE,en,PT2M26S,146,"Advanced Programming Languages (e.g., C++, Java)"
XSw-4p8zoVc,UC9JWnvl5ZjZv09F5RqiLptw,Java in 2023 : Still Worth Learning? | Java Programming Pros & Cons | Programming Language | #shorts,27,"java tutorial, java programming, learn java, java tutorial for beginners, java vs python, java learning, java vs kotlin, how to learn java, java for beginners, should you learn java, should you learn java in 2023, java coding, java programming language, java programming for beginners, java programming tutorial, scaler, scaler academy, Saumya Singh, Aanshul Sadaria, programming, coding, programming podcast, learn java from scratch, java vs python vs c++, java vs python 2023",SCALER,252000,358179,15459,0,124,https://www.youtube.com/watch?v=XSw-4p8zoVc,en-IN,PT46S,46,"Advanced Programming Languages (e.g., C++, Java)"
3PcIJKd1PKU,UCDNCqs2pvtW3S-Iys-2ATMw,Python vs C/C++ vs Assembly side-by-side comparison,28,"python, c/c++, c programming, c++ programming, assembly, asm, x86, x86_64, programming, coding, performance, comparison, speed, time",xmdi,12100,3758306,62256,0,2976,https://www.youtube.com/watch?v=3PcIJKd1PKU,Unknown,PT1M1S,61,"Advanced Programming Languages (e.g., C++, Java)"
WjKQQAFwrR4,UCUyeluBRhGPCW4rPe_UvBZQ,"How Much Memory for 1,000,000 Threads in 7 Languages | Go, Rust, C#, Elixir, Java, Node, Python",28,"programming, computer, software, software engineer, software engineering, program, development, developing, developer, developers, web design, web developer, web development, programmer humor, humor, memes, software memes, engineer, engineering, Regex, regexs, regexes, netflix, vscode, vscode engineer, vscode plugins, Lenovo, customer service",ThePrimeTime,265000,424971,9526,0,954,https://www.youtube.com/watch?v=WjKQQAFwrR4,en-US,PT26M21S,1581,"Advanced Programming Languages (e.g., C++, Java)"
tyxMSr7N50M,UCFpBrIzOwhi0i0oGC6kgDHA,c programming | c programming for beginners | c programming tutorial | c language | #shorts,27,"c programming, c programming language, c programming for beginners, c programming tutorial, c language, html, html tutorial for beginners, c tutorial for beginners, java tutorial for beginners, python Tutorial for Beginners, html tags, html course, html tag, html and css tutorial for beginners, html and css tutorial, learn c programming, c programming full course, c programming projects, c programming hsc",Code 10TB,29000,703266,29972,0,631,https://www.youtube.com/watch?v=tyxMSr7N50M,Unknown,PT5S,5,"Advanced Programming Languages (e.g., C++, Java)"
FFZ7jb9c1JU,UCFZNt5kqkXGBAUitidv_PhQ,The WORST Programming Languages EVER #shorts,23,"Programming, Programmer, Bad programming languages, Good programming languages, Beginner programming, Parody, Dev, Developer, Python, Java, Javascript",tldrtech,869,227502,7289,0,2303,https://www.youtube.com/watch?v=FFZ7jb9c1JU,Unknown,PT31S,31,"Advanced Programming Languages (e.g., C++, Java)"
yRpLlJmRo2w,UCBwmMxybNva6P_5VmxjzwqA,Introduction to Java Language | Lecture 1 | Complete Placement Course,27,"C++, C++ coding, C++ full course, C++ placement course, how to code, programming, college placement course, C++ language, java, java coding, java full course, java placement course, java language",Apna College,4660000,10264468,245296,0,5136,https://www.youtube.com/watch?v=yRpLlJmRo2w,Unknown,PT18M46S,1126,"Advanced Programming Languages (e.g., C++, Java)"
C4btqWgYCx4,UCecWXriu_hPT2mK3AJhtP6g,I Learned C++ In 24 Hours,28,N/A,Neel Banga,14400,930753,28487,0,1262,https://www.youtube.com/watch?v=C4btqWgYCx4,en-US,PT32S,32,"Advanced Programming Languages (e.g., C++, Java)"
coihavp4M1Q,UCqrILQNl5Ed9Dz6CGMyvMTQ,Top 5 Programming languages,27,N/A,Clever Programmer,1300000,1444959,76045,0,804,https://www.youtube.com/watch?v=coihavp4M1Q,en,PT58S,58,"Advanced Programming Languages (e.g., C++, Java)"
eIrMbAQSU34,UCWv7vMbMWH4-V0ZXdmDpPBA,Java Tutorial for Beginners,27,"java, java tutorial, java tutorial for beginners, learn java, java course, java 12, java 8, java 8 tutorial, java programming, java programming for beginners, java training, java for beginners, java 8 tutorial with examples, java 8 course, java programming tutorial, programming, tutorial, beginners, programming with mosh, code with mosh, mosh hamedani, learn to code",Programming with Mosh,3680000,10162599,245357,0,7961,https://www.youtube.com/watch?v=eIrMbAQSU34,en,PT2H30M48S,9048,"Advanced Programming Languages (e.g., C++, Java)"
RRubcjpTkks,UC_fFL5jgoCOrwAVoM_fBYwA,Learn Java in 14 Minutes (seriously),27,"learn java, java, java tutorial for beginners, learning java, how to learn java, java programming, learn to code java, learn java code, learning java programming, learn to code java in 13 minutes, learn java easy, learn java programming, learn java quick, learn java easy way, learn java coding, how to code in java, code java, how to code java, quickest way to learn java, learn to code java for beginners, how to learn java quickly and easily, learn java for beginners",Alex Lee,390000,4348327,195364,0,4710,https://www.youtube.com/watch?v=RRubcjpTkks,en,PT14M,840,"Advanced Programming Languages (e.g., C++, Java)"
q1ZmFc-sqNc,UC6biysICWOJ-C3P4Tyeggzg,the TRUTH about C++ (is it worth your time?),28,"c vs c++, c++, is c++ good, c++ for beginners, programming challenge, c programming, c challenge, coding challenge, coding meme, endianness, big endian, little endian, c pointers, c pointers tutorial, pointers tutorial, programming for beginners, programming language, programming in c, programming hero, programming fundamentals, programming memes",Low Level Learning,362000,430480,13381,0,1275,https://www.youtube.com/watch?v=q1ZmFc-sqNc,en,PT3M17S,197,"Advanced Programming Languages (e.g., C++, Java)"
k7LSFYyBZUs,UClLXKYEEM8OBBx85DOa6-cg,Coding for 1 Month Versus 1 Year #shorts #coding,28,N/A,Devslopes,242000,1782715,84009,0,1134,https://www.youtube.com/watch?v=k7LSFYyBZUs,en,PT24S,24,"Advanced Programming Languages (e.g., C++, Java)"
1Zku-mXDY9g,UC4JX40jDee_tINbkjycV4Sg,Why You Should Learn C++,27,"tech with tim, programming, coding, c++, learn c++, c++ tutorial, should you learn c++, is c++ hard, is c++ worth learning, should I learn c++, should you learn c++ 2023, c++ 2023, c++ programming, c++ coding, software engineer, computer science, c++ language",Tech With Tim,1400000,252202,12922,0,320,https://www.youtube.com/watch?v=1Zku-mXDY9g,en-CA,PT35S,35,"Advanced Programming Languages (e.g., C++, Java)"
YgCq0Y6Mhh0,UCKaYxkHrmsQePZFpzF9b7sQ,C++ Coders Be Like...,28,N/A,Mr. P Solver,121000,416943,16376,0,773,https://www.youtube.com/watch?v=YgCq0Y6Mhh0,Unknown,PT2M17S,137,"Advanced Programming Languages (e.g., C++, Java)"
yLOqh9Fr7uU,UCMSI1Ck1mJOaxxwJ0bzrYhQ,Top 5 programming languages to get a job in 2022 #shorts,24,N/A,The Urban Fight,3200000,1894790,94089,0,1115,https://www.youtube.com/watch?v=yLOqh9Fr7uU,Unknown,PT1M,60,"Advanced Programming Languages (e.g., C++, Java)"
vJtQP3_eR4U,UCQAhHBxFTnkZxy-V4hZ8X_w,Java VS C++ | 💻 Which programming language is best ?,27,"Different Developer, Android app development, c language tutorial, arsil, java tutorials in hindi, python in hindi, difference between c++ and java, java vs c++, java vs c++ for dsa, java vs c++ which is easier, java vs c++ speed comparison java vs c++ which to learn, java vs c++ difference, java vs c++ syntax, java vs c++ speed, java vs c++ in hindi, java vs c++ for competitive programming, java vs c++ performance, java vs python, codewithharry java, android app development",Different Developer,26200,88582,0,0,65,https://www.youtube.com/watch?v=vJtQP3_eR4U,Unknown,PT59S,59,"Advanced Programming Languages (e.g., C++, Java)"
1tON1Ui9ksk,UCM5QNdoIefx6eumjPk8ZTMw,FREE C++ Programming Course | Beginner to Advance Full Course | Learn C++,26,"c++ full course, cpp complete course, c plus plus full course, complete c++ in one video, c++ tutorial for beginners, c++ programming, c++ tutorial in hindi, c++ full course in hindi, c++ complete course, c++ by learn coding, c++ full course 2021, c++ tutorial for beginners full course, c++ course, learn c++ full course, c++ full course for beginners, c++ full course free, c++ tutorial from basic to advance, learn coding, programming, full course of c++, learn c++",Azad Chaiwala,1770000,251824,7181,0,463,https://www.youtube.com/watch?v=1tON1Ui9ksk,en,PT3H49M36S,13776,"Advanced Programming Languages (e.g., C++, Java)"
Wy-Xn5ZhSm8,UChJZ1MEX7Jiszb1lF0vVQkw,"Difference between C, C++, & JAVA programming language",27,"#ProgrammingLanguages, #C, #C++, #Java, #Syntax, #Features, #ApplicationDomains, #ProceduralProgramming, #OOP, #SoftwareDevelopment, #JavaShorts",CIMAGE PATNA,36700,503649,18492,0,0,https://www.youtube.com/watch?v=Wy-Xn5ZhSm8,hi,PT52S,52,"Advanced Programming Languages (e.g., C++, Java)"
WO7wT-FX2mA,UC44VQzJ6-8UpUeqnfWgSSGg,5 Years of Coding in under a Minute #shorts,22,"coding, programming, computer science, software engineering, software engineer, coding journey, software engineering journey, shorts",Abhi,44100,4693096,250827,0,1529,https://www.youtube.com/watch?v=WO7wT-FX2mA,en-GB,PT56S,56,"Advanced Programming Languages (e.g., C++, Java)"
6DYjWGfvM3s,UCWI-ohtRu8eEeDj93hmUsUQ,The HARDEST part about programming 🤦‍♂️ #code #programming #technology #tech #software #developer,28,N/A,Coding with Lewis,483000,878506,29778,0,535,https://www.youtube.com/watch?v=6DYjWGfvM3s,en,PT28S,28,"Advanced Programming Languages (e.g., C++, Java)"
U5RYnQ-fVTg,UCRLEADhMcb8WUdnQ5_Alk7g,Why people HATE JAVA 😡☕️  #coding #programming,27,N/A,Aaron Jack,403000,511194,17739,0,920,https://www.youtube.com/watch?v=U5RYnQ-fVTg,en,PT45S,45,"Advanced Programming Languages (e.g., C++, Java)"
Fze6w1LbDmc,UCiT_r1GD7JSftnbViKHcOtQ,Rust Programming - No Inheritance,28,N/A,Jeremy Chone,18700,283778,10471,0,285,https://www.youtube.com/watch?v=Fze6w1LbDmc,Unknown,PT23S,23,"Advanced Programming Languages (e.g., C++, Java)"
y193EGxpX0E,UC59K-uG2A5ogwIrHw4bmlEg,1 tip to improve your programming skills,28,N/A,Telusko,2180000,760688,44103,0,209,https://www.youtube.com/watch?v=y193EGxpX0E,en,PT34S,34,"Advanced Programming Languages (e.g., C++, Java)"
ErHtcLZGoOI,UCWI-ohtRu8eEeDj93hmUsUQ,EVERY programmer should follow this principle 👩‍💻 #technology #programming #software #career #code,28,N/A,Coding with Lewis,483000,3107623,196373,0,1069,https://www.youtube.com/watch?v=ErHtcLZGoOI,Unknown,PT35S,35,"Advanced Programming Languages (e.g., C++, Java)"
udZJxhK28L8,UCvT21bzLRHrnAc-F1SRqRSw,Which programming language is best for getting a job? | Java or Python #short,27,N/A,TAP ACADEMY,59900,176018,7847,0,85,https://www.youtube.com/watch?v=udZJxhK28L8,en-IN,PT26S,26,"Advanced Programming Languages (e.g., C++, Java)"
G7Y8KYbJYnc,UCptc7b3jk_PtbpLLeZojRZA,Best Programming Language for Beginners!!🧑🏽‍💻,22,"indian vlogger, indian software engineer in usa, singh in usa",Harnoor Singh,214000,486950,30321,0,432,https://www.youtube.com/watch?v=G7Y8KYbJYnc,en-IN,PT58S,58,"Advanced Programming Languages (e.g., C++, Java)"
hRUJ41rdp4M,UClLXKYEEM8OBBx85DOa6-cg,1 Year of Coding #programming #comedy #coding,24,N/A,Devslopes,242000,1117757,54233,0,641,https://www.youtube.com/watch?v=hRUJ41rdp4M,en,PT19S,19,"Advanced Programming Languages (e.g., C++, Java)"
-TkoO8Z07hI,UC4SVo0Ue36XCfOyb5Lh1viQ,C++ Full Course for free ⚡️,28,"C++ tutorial, C++ programming tutorial, learn C++, C++ language tutorial, learn C++ programming, learn C++ language, C++ tutorial for beginners, C++ programming tutorials, how to learn C++ language, how to learn C++, c++ programming, c++, c++ basics, c++ language, c++ tutorials, c++ for beginners, C++ Tutorials From Basic to Advance, c++ tutorials complete, c++ video tutorial, c++ programming tutorial complete, c++ programming tutorial for beginners, c plus plus",Bro Code,1470000,2487972,89157,0,2910,https://www.youtube.com/watch?v=-TkoO8Z07hI,en,PT6H,21600,"Advanced Programming Languages (e.g., C++, Java)"
